{"candidates":[],"context":"震荡","hypotheses":[{"holds_if":"后续到达 0.5934–0.5976 区后多头跟进、收盘站上 0.5976，震荡上沿被实质抬升","id":"H1","menu":["B3","G1"],"statement":"宽幅震荡（0.5515–0.6134）内自低点筑底后的上攻尝试：价格刚离开基地上沿 0.5841，正赴上方 0.5976 缺口/要塞决胜点，现价本身不在决胜点上","takeover_if":"到达 0.5976 附近后 1–3 根内收回 0.5841 内侧并出现空头跟进，假突破成立，H2 接管","void_if":"价格收回 0.5841 之下且跟进走弱，上攻作废、回基地内部继续震荡"},{"holds_if":"0.5976 附近滞涨、长上影或收回该位之下，随后跌破 0.5841 并有空头跟进","id":"H2","menu":["B3","G1"],"statement":"上攻只是赴解套位的一腿：0.5976 上方套住多头（depth 0.0481），价格回补到位即遇抛压，翻面下行回基地/区间下部","takeover_if":"收盘站上 0.6021 要塞带上沿并有跟进，多头结构升级，空头面作废","void_if":"强势收在 0.5976 上方且回踩守住、再向 0.6056/0.6111 推进"}],"no_trade_reason":"位置不对","pending_conditions":[{"missing":["突破尚未失败：价格正向上试探 0.5934–0.5976 区，无收回位内 + 反向跟进的裁定事实","回收窗口（到达决胜点后 1–3 根）尚未开启，第一根回调依法属于突破方"],"setup":"B3","watch":"价格到达 0.5934–0.5976 区后 1–3 根内收盘收回 0.5841 内侧并出现空头跟进 K，即按 B3 空申报（入场=翻面位 0.5841 区，止损置突破腿极值 0.5988/0.6056 外侧）"},{"missing":["R2 落点不在位：现价 0.5902 距目标缺口锚 0.5976 为 0.0074，超出 ±0.25×段均幅（±0.0025）容差","R3 到达行为缺失：价格尚未到达 0.5976 落点，无回补未遂后的反向跟进或顺势强信号 K"],"setup":"G1","watch":"价格到达 0.5976 锚（同址要塞带 0.5934–0.6021、摆动高点 0.6056 为独立组）后出现拒绝行为：冲锚未遂 + 空头信号 K 收回锚下，按 G1 空申报；或站稳锚上回踩守住则改审多头面"}],"primary":"H1","uncertainty":["图读为宽幅震荡内基地上攻，与附件 trend=震荡/边界一致，无冲突","上方 0.5934–0.6021 与 0.5986–0.6098 两条要塞带均标 decaying，到达时的拒绝强度只能由现场行为确认，B3/G1 在到达前均无法认定"]}