{"candidates":[],"context":"震荡","hypotheses":[{"holds_if":"价格继续在 111.0-141.22 间宽幅往返、无带跟进的收盘站出区间","id":"H1","menu":["B3","C1"],"statement":"抛物线买入高潮（141.22）后的宽幅顶部震荡，价格在 111-141 区间中部来回套人，无一方站稳","takeover_if":"","void_if":"带跟进收盘站上 141.22 创新高，或收盘跌破 111.0 并跟进"},{"holds_if":"第二腿下跌保持跟进、反弹不过 129.35","id":"H2","menu":["C1"],"statement":"空头 MTR 正在成形：高潮后两腿下跌、回测 129.35 已失败，等极值区触发","takeover_if":"价格回到 124.88-129.35 极值区并给出合格级空头信号 K，C1 三件套全审通过","void_if":"收盘站回 129.35 上方并守住"}],"no_trade_reason":"位置不对","pending_conditions":["价格回到 124.88-129.35 上沿极值区并出现合格空头信号 K → C1 三件套全审（老趋势/两腿衰竭/TBTL）","价格下行到达 100.75 敞开缺口锚（落点须在锚线 ±2.58 内）且叠加到达行为 → 审 G1 空头回补缺口","带跟进收盘突破 141.22 或跌破 111.0 → 按突破事件重审方向与 B3"],"primary":"H1","uncertainty":["mm.candidates 置信为边界，且锚为最早一段腿的投影、与当前顶部结构无关","trend 置信为边界（震荡标签），语境以图读的高潮后顶部区间为准","fortress.bands 粒度过粗（55.99-87.2 巨带），决胜点以图读自画为准"]}