{"candidates":[],"context":"下降","hypotheses":[{"holds_if":"反弹在 P3 2214.64-2224.99 或 P4 2240.0-2257.88 出现滞涨与空方信号，且回落收盘重新跌破 2209.34","id":"H1","menu":["B2","B3"],"statement":"下降战役中的弱反弹：2373.0 至 2190.19 的急跌腿后仅单腿反弹至 2221.84，上方阻力带逐级压制，反弹失败后向 P2/P1 再探并寻求续跌","takeover_if":"收盘突破 P4 上沿 2257.88 且回踩不破，或收盘收复 P5 下沿 2295.88 时 H2 接管","void_if":"收盘站上 2257.88 并跟进，继而收复 2295.88 缺口锚下沿"},{"holds_if":"收盘逐级站上 2224.99、2257.88，并进入 P5 2295.88-2323.75 缺口区出现承接","id":"H2","menu":["B3","C1"],"statement":"急跌后筑底反转候选：2190.19 为恐慌低点，反弹逐级收复阻力并回补上方套牢多头缺口群，行情转入向上修复","takeover_if":"收盘站上 2257.88 带跟进、或在 P1/P2 出现第二次探底失败并强势收回时 H2 接管","void_if":"收盘跌破 2190.19 创新低且跟进，反转低点被证伪"}],"no_trade_reason":"无命中","pending_conditions":[{"missing":["P4 到达后的衰竭与合格空方信号 K 未出现：决策根收盘 2243.01 位于 P4 2240.0-2257.88 带内，但决策根为阳线（实体占比 0.8294、CLV 0.7291），是多方进入带内而非空方信号与反向跟进","H1 holds_if 的回落收盘重新跌破 2209.34 未发生"],"setup":"B2","watch":"等价格在 P4 2240.0-2257.88 内滞涨并出现合格空方信号 K 收回带下沿之下、伴衰竭与反向跟进时再审 B2 空，point_id=P4"},{"missing":["决策根收盘 2243.01 不在 P2 2209.34 ±0.25×段均幅（段均幅 12.191053，容差约 3.05）内，也不在 P1 2190.19-2206.03 带内，位置未到达","下探决胜点后收回其上并多方跟进的跌破失败触发在决策根未出现"],"setup":"B3","watch":"等价格下探 P2 2209.34 附近或 P1 2190.19-2206.03 带内，刺破后收回带内并出现多方跟进时再审 B3 多，point_id=P2/P1"},{"missing":["R2 落点未到达：敞开缺口锚群在 2295.88-2354.06，决策根 2243.01 距最近锚 2295.88 逾 50，不在锚线 ±0.25×段均幅内","R3 到达行为未出现：价格未进入 P5/P6 缺口要塞区，无回补受阻或第二次回补未遂后反向跟进"],"setup":"G1","watch":"等价格到达 P5 2295.88-2323.75 或 P6 2337.1-2354.06 缺口要塞区并出现明确到达行为时再审 G1"}],"primary":"H1","uncertainty":["附件 trend 机器标签为震荡/边界，与冻结地图的下降战役定性冲突，按地图与图读急跌后弱反弹结构取下降，附件标签不单独支撑语境","最大不确定是 2190.19 后单腿反弹究竟是熊市回调还是筑底第一腿，尚无第二腿验证；MM已达依据为区间 2298.42-2387.5 高度 89.08 向下投影至 2209.34 已被 2190.19 超越","决策根阳线进入 P4 阻力带与空方主假设方向相反，若后续收盘站上 2257.88 并跟进，H1 按其 void_if 失效并由 H2 接管审"]}