{"candidates":[],"context":"震荡","hypotheses":[{"holds_if":"回踩在 P1–P3 任一支撑带止跌并出现顺势信号 K，价格结构维持在 EMA（0.2323）上方","id":"H1","menu":["A1","B2"],"statement":"上升趋势未破，自 0.2848 的回落是高位回踩/旗形，支撑决胜点守住后续走新高","takeover_if":"冲高 0.2848 失败收回成立（B3 触发），或收盘跌破 0.2421 后反弹只做出更低高点","void_if":"收盘跌破 0.2127（本轮加速腿突破起点一带），顺势读法失效"},{"holds_if":"冲高 0.2848 后 1–3 根内收回收回带内并反向跟进，或跌破 P1 后反弹无力","id":"H2","menu":["B3","C1"],"statement":"末段高潮式加速已衰竭，0.2848 为阶段顶，行情转入高位震荡/顶部修正","takeover_if":"收盘有效跌破 0.2127 且回抽不过，顶部修正升级，按 C1 反转三件套审","void_if":"强阳线收盘站上 0.2848 且跟进创出新高"}],"no_trade_reason":"位置不对","pending_conditions":[{"missing":["冻结地图已作废：须在现价低位区间（0.16–0.20）重画战役地图、重新预画决胜点后再审","C1 三件套须在新地图语境下全新审计，本遍不沿用作废地图审"],"setup":"C1","watch":"重画地图后，看低位区间边缘（0.1645–0.1782 / 0.1781–0.1938 要塞带）被测试时的到达行为再定分支"}],"primary":"H2","uncertainty":["campaign_void_if 已触发：bar96 收盘 0.1936 首破 0.2000 要塞下沿、bar97 收盘 0.1679（低点 0.1459）确认跌破，上升定性翻面，整张冻结地图作废——本遍按到达核对动作 2 空仓，不在作废地图上执行任何分支","H1 的 void_if（收盘跌破 0.2127）已先行触发，主假设死亡；H2 的 takeover_if（收破 0.2127 且回抽不过）亦已成立，故 primary 更新为 H2 并把后续审计推给重画地图后的 C1 三件套","现价 0.1749 位于全部地图决胜点（P1–P4）下方、处在 0.16–0.20 低位宽幅区间内，无任何地图点位正在被测试；最后一根（收 0.1749、低点 0.1600 长下影）是区间内部行为，不构成作废地图上的任何分支触发"]}