{"candidates":[],"context":"下降","hypotheses":[{"holds_if":"反弹在 5.719–5.941 要塞带下沿与 5.74 锚下方滞涨，并出现阴线实体收盘的信号 K","id":"H1","menu":["A2","G1"],"statement":"下降趋势中两腿反弹已抵 EMA 与 5.74 缺口锚/要塞带下沿，属顺势做空的候选测试区，但触发未到","takeover_if":"价格收盘回补 5.74 锚且跟进上行、进而测试 6.473 锚一带时，备选假设接管","void_if":"收盘站上 5.74 并回补该锚（账本销账），或收盘站稳 5.941 之上"},{"holds_if":"收盘站稳 5.941 之上且回踩不破，反弹走出更高摆动高点","id":"H2","menu":[],"statement":"长下跌后的低位筑底尝试：4.407 一带反弹若站稳 5.94 上方，下跌趋势降级为震荡/反转候选","takeover_if":"收盘回补 5.74 与 6.35 缺口锚、摆动序列转为 HH+HL 时接管为主假设","void_if":"出现顺向阴信号 K 并收盘跌破 5.288–5.561 要塞带，恢复下跌腿"}],"no_trade_reason":"成色不合格","pending_conditions":[{"missing":["顺向阴信号K未出现：决策根为阳线、收近当日高（CLV 0.744），无空头触发","反弹对最近下跌腿（6.35→4.407）收复已逾 50%，按卡降级为观察，顺势成色打折","附件 MM 候选陈旧（基于 bar10–12 腿）、置信=边界，趋势 MM 未达无法据附件确认"],"setup":"A2","watch":"等反弹在 EMA 5.64 / 要塞带 5.719–5.941 下沿一带出现阴线实体收盘、信号 K 大半截不在 EMA 错侧且盘中不创新高（≤5.705）的那一根"},{"missing":["R3 到达行为未达标：目标缺口 5.74（origin，套多）attempts=0，决策根非顺势强阴 K（振幅 0.211 小于 1.3×剪均幅且为阳线），无回补未遂后的反向跟进"],"setup":"G1","watch":"等价格触 5.74 锚后 1–3 根内出现强阴 K 收在锚下方（回补未遂+反向跟进），或出现第二次回补未遂；落点须保持在锚 ±0.070 容差内且有要塞带 5.719–5.941 独立锚组叠加"}],"primary":"H1","uncertainty":["附件 pullback.depth_ratio=0.265 与按最近一腿口径的图读收复逾六成不一致，降级线判断以图读结构为准","附件 MM 置信=边界且候选基于早期腿，当前下跌趋势是否成熟（MM 已达）未定"]}