{"candidates":[],"context":"下降","hypotheses":[{"holds_if":"价格保持在82178.2下方且顺向阴线推进、敞开缺口继续套住多头","id":"H1","menu":["A2","B2"],"statement":"下降趋势未完，反弹第二腿在82178.2一带结束，价格续跌先考81718.0再赴80904.63的MM投影","takeover_if":"收盘突破并站稳82178.2且回踩不破时备假设接管","void_if":"收盘站上82991.57（本腿起点）"},{"holds_if":"收盘站上82178.2并出现跟进，回踩82178.2不破","id":"H2","menu":["B3"],"statement":"81718.0低点后转入震荡或反弹修复，价格收复82178.2后依次回补上方缺口并测试P3","takeover_if":"收盘突破并站稳82178.2且回踩不破时接管主假设","void_if":"强收盘跌破81718.0并有跟进"}],"no_trade_reason":"位置不对","pending_conditions":[{"missing":["顺向跟进未成立：决策根为小阳线而非强阴线收盘跟进","决策收盘81545.05不在P1点81718.0的±0.25×段均幅（约48.7）测试区内，距点约173点"],"setup":"B1","watch":"等后续1-3根内出现强阴线收盘在81718.0下方跟进，且价格回到P1测试区附近时再审B1"},{"missing":["未收回翻面位：决策收盘81545.05仍在81718.0下方，未收盘收回位内","无反向跟进：决策根仅小阳线实体约34%，不足以认定反向跟进"],"setup":"B3","watch":"等跌破后1-3根窗口内收盘收回81718.0上方并出现反向跟进时再审P1的B3翻面"},{"missing":["位置不在测试区：决策收盘远离P2点82178.2，超出±0.25×段均幅","第二腿触发未在决策根成立：附件pullback legs=1、two_legs=false，决策根亦非P2下方的顺向阴线实体收盘"],"setup":"A2","watch":"等价格回到P2点82178.2测试区、反弹第二腿在该点下方以顺向阴线实体收盘且不创反弹新高时再审A2"}],"primary":"H1","uncertainty":["决策根是强阴跌破81718.0后的首根小阳线（实体约34%、与前根重叠约46%），既非B1的顺向跟进、也未收回81718.0，1-3根回收窗口尚未走满，突破失败与有效跟进均未裁定","附件pullback记legs=1、two_legs=false，与A2/B2所需的第二腿形态不符，第二腿是否衰竭仍需到达行为确认，与冻结地图uncertainty一致","决策收盘81545.05距最近决胜点P1约0.89×段均幅（段均幅194.997），按点名硬纪律只能挂起不能标qualified；81718.0下方至MM投影80904.63之间无预画完好要塞，破位后扩展路径不确定"]}