{"candidates":[],"context":"震荡","hypotheses":[{"holds_if":"收盘保持在 167.07 下方、反弹不过 169.12","id":"H1","menu":["B3"],"statement":"宽幅区间（约 163.4–174）延续：173.98 上破失败、171.14 回测翻面位失败后空头跟进（决策根强阴收 166.29、CLV −0.98），价格向区间下沿 165.23 缺口锚与 163.4–165.0 低点簇运行","takeover_if":"价格在 165.23 一带止跌并强阳收回收复 167.07 时，H2 接管","void_if":"收盘站回 171.14 上方，翻面失败作废"},{"holds_if":"到达 165.2 一带后出现止跌强阳并收回收复 167.07","id":"H2","menu":["B3"],"statement":"下沿支撑簇（165.23 敞开缺口锚 + 163.76/164.99 摆动低点）令下破衰竭，区间下沿反弹或下破失败翻多","takeover_if":"下破 165.23/163.76 后 1–3 根内收回位内加多头跟进时接管，审 B3 多头翻面","void_if":"收盘有效跌破 163.4 区间下沿"}],"no_trade_reason":"位置不对","pending_conditions":[{"missing":["入场位已离开翻面位：上破失败的第一次回踩在 171.14（第 75 根）已过，决策点现价 166.29 位于区间中部赶路区，非决胜点","决策根虽为反向跟进强阴，但属下行第三根、已贴近下方支撑簇，此时入场是追空而非翻面位扣扳机"],"setup":"B3","watch":"等反弹回 169.5–171.1 翻面带再次失败并出阴线确认，在翻面位审空头候选；或等下破下沿失败后按 H2 审多头面"},{"missing":["R2 落点叠加不成立：做空落点应在 173.94 多头被套缺口锚 ±0.60 内，现价 166.29 距锚 7.65；做多落点应在 165.23 空头被套缺口锚 ±0.60 内，现价距锚 1.06 且尚未到达","R3 到达行为未在落点处成立：173.94 一带的回补未遂发生在第 71–75 根、已离开落点；165.23 锚尚未被触及（attempts 0）"],"setup":"G1","watch":"等多头回补 173.94 再失败于叠加点，或价格到达 165.23 锚后回补未遂出反向收盘，再按矩阵重审"}],"primary":"H1","uncertainty":["附件要塞带为整幅巨带 163.45–171.49（anchors 34），决胜点粒度不足，翻面位与边缘以图读摆动极值 171.14/173.98/163.4 代之","确认事件的反向收盘（决策根）已出现，但其位置在区间中部而非任一缺口锚/翻面位，按位置关判空仓；若只认事件不认位置，此处会与 B3 卡入场位要求冲突，以卡为准"]}