{"candidates":[],"context":"上升","hypotheses":[{"holds_if":"价格守住 165.15 翻面位上方、回踩不破并再出顺向实体 K","id":"H1","menu":["A1","G1"],"statement":"强上升趋势延续：168 高点后的回调在 162 一带走完两腿，价格已收复 165.15/165.34 翻面位，将再攻 168.05 套多缺口锚与 168.84 前高","takeover_if":"跌破 162.19 且反抽不过 165.34，回调升级、由 H2 接管","void_if":"收盘跌破 162.19 第二腿低点"},{"holds_if":"168.05–168.84 再攻失败并出现强阴跟进、跌回 165.15 下方","id":"H2","menu":["G1"],"statement":"本轮上攻是高位派发反弹：168 一带套牢多头等解套出货，二次上攻未遂后价格转入下行赴下方账本","takeover_if":"站稳 168.84 上方并回补 168.05 锚，则派发说作废、回 H1 延续","void_if":"强收盘站上 168.84 创窗口新高"}],"no_trade_reason":"成色不合格","pending_conditions":[{"missing":["合格级信号 K 未出现：决策根实体仅 9.6%、长上影逼近 168 阻力簇，无顺向实体收盘","回吐深度附件计 0.924、已过本卡 50% 降级线，两腿认定与降级解除须待复核"],"setup":"A1","watch":"回踩 165.15–165.34 翻面位守住后出顺向实体信号 K（不创反向新极值），按 H2 触发重审 A1"},{"missing":["空头面 R3 未成立：价格只触 168.05 锚落点带下沿 167.58、未碰锚线本身，且无空头强信号 K 收回","多头面 R3 未成立：价格未回落到达 165.34 锚线落点带（现价高出锚线约 1.31）"],"setup":"G1","watch":"上攻真正到达 168.05–168.24 锚/前高簇后出强阴收回 167.4 下方（空头面），或回落到 165.34±0.47 落点带且回补未遂后出顺向强阳（多头面）"}],"primary":"H1","uncertainty":["附件 pullback 计 1 腿、深度 0.924，与图读两腿回调（162.89/162.19 双低夹一次反弹至 165.46）冲突，A1 降级线认定两说并陈","附件 mm 候选置信为边界且目标（136.43/141.26）明显过期，趋势 MM 未达缺数字支撑、只据图读通道认定","168.05 缺口锚 source=origin，与摆动高点 168.24 是否同源分组存疑，空头面 G1 的 R2 锚组计数待裁决层口径"]}