{"candidates":[],"context":"下降","hypotheses":[{"holds_if":"价格保持在P2带78649.67-78884.52下方、反弹高点不越78781.24，且敞开缺口锚80472.61仍套住多头未被回补。","id":"H1","menu":["A2","B2","B1"],"statement":"下降趋势延续：自80954.65起的急跌腿未被收复，反弹至78781.24回吐约五成后受阻回落，价格续跌依次考验下方支撑P3与P4。","takeover_if":"下方P3或P4出现跌破失败并收回带上、或价格强势收盘站上P2带时，备假设H2接管。","void_if":"收盘站上78884.52并进一步收复80472.61，下降结构与账本立论同时失效。"},{"holds_if":"价格在P4的76650.02上方止跌，跌入P3/P4后收盘收回其上沿，且反弹能逐级收回P1带。","id":"H2","menu":["B3"],"statement":"急跌后低位震荡筑底：76650.02一带二次探底不破、跌破P3/P4均失败翻面，行情转入震荡并向上回测P1/P2。","takeover_if":"强阴收盘破76650.02带跟进、或反弹在P1/P2再遭拒绝并创新低时，主假设H1重新接管。","void_if":"强阴实体收盘跌破76650.02并有跟进，新低确认则筑底假设作废、回到H1延续面。"}],"no_trade_reason":"位置不对","pending_conditions":[{"missing":["反弹仅走出一腿（附件pullback legs=1、two_legs=false），第二腿未成形","价格未到达P1带78185.38-78577.31或P2带78649.67-78884.52，决策根收盘76938.01不在任一阻力带±0.25×段均幅（66.54）内，stop轨到达不成立","无在决胜点带内冲高不创新高后阴实体收回带下的信号K"],"setup":"A2","watch":"等反弹走出第二腿并到达P1（78185.38-78577.31）或P2（78649.67-78884.52）带内，出现不再创新高且阴实体收盘收回带下沿下方时再审A2空"},{"missing":["P4限价轨到达不成立：决策根区间76918.23-77068.00与P4点位76650.02不相交","P4此前收回76650.02上方的阳线跟进发生在数根之前，已超出分支1-3根裁定窗口，决策根为阴实体收盘、无当根收回带上加跟进的翻面触发","P3限价轨同样不成立：决策根区间与P3带77252.14-77436.43不相交"],"setup":"B3","watch":"等价格再次探入P4的76650.02并在1-3根内收盘收回其上方、出现强阳跟进，且决策根区间与该点相交时再审B3多"},{"missing":["P4破位空的stop轨到达不成立：决策根收盘76938.01距76650.02达287.99，远超±0.25×段均幅（66.54）容差","决策根不是跌破76650.02的强阴收盘，其后亦无创新低跟进（价格已收回该点上方，该分支按地图条款处于失效侧）"],"setup":"B1","watch":"等强阴实体收盘跌破76650.02且下一根继续创出新低跟进、决策根收盘落入该点容差带内时再审B1空"}],"primary":"H1","uncertainty":["下行MM无从投影：附件MM候选仅为旧上行腿的投影且置信为边界、无可信下行锚，故76650.02下方空间无锚可量（冻结地图原文）","P4一带近期多次收盘跌破又收回76650.02，B3翻面与B1破位分支均曾短暂触发又失效，该点库存反复消耗、成色含糊","决策根收盘76938.01距P4达287.99、距P3下沿达314.13（段均幅266.16），处于两决胜点之间的赶路区，图读与地图位置一致、无冲突"]}