{"candidates":[],"context":"震荡","hypotheses":[{"holds_if":"收盘站稳 1.0186 前高上方且回踩守住该位","id":"H1","menu":["G1"],"statement":"大区间内二次探底后的修复反弹延续：0.859 与 0.8961 低点抬高，决策根自 0.9535 翻面位强阳拉起收 1.0238，上方目标为 1.0011–1.1018 要塞带与 1.1472 套多锚","takeover_if":"冲高后收回 1.0011 要塞带下沿下方并阴线跟进，H2 接管","void_if":"收盘跌回 0.9535 下方，翻面位失守"},{"holds_if":"1–3 根内收盘跌回 1.0186 下方并出现阴线跟进","id":"H2","menu":["B3"],"statement":"决策根冲高 1.062 留长上影为要塞带下沿前的假突破，收回位内加跟进走弱后回区间中下部 0.9067/0.8761","takeover_if":"出现收回 1.0186 下方加阴线跟进即接管，B3 空在翻面位审","void_if":"收盘站稳 1.05 上方并守住回踩"}],"no_trade_reason":"无命中","pending_conditions":[{"missing":["突破失败未确认：决策根虽冲高 1.062 留长上影，但收盘 1.0238 仍在被破位 1.0186 之上，未收回位内、无反向跟进"],"setup":"B3","watch":"等 1–2 根内收盘跌回 1.0186（或要塞带下沿 1.0011）下方并阴线跟进，在翻面位审空，止损放 1.062 外侧"},{"missing":["R2 落点不合：市价 1.0238 距 0.9535 锚约 1.6 倍段均幅，不在锚 ±0.25×段均幅（±0.011）内","到达锚 0.9889 已于 bar151 回补关闭（V2 销账）；0.9535 新锚 attempts 0、duration 0，R3 回补未遂计数无沉淀"],"setup":"G1","watch":"等价格回踩 0.9535 锚带（0.9425–0.9645）守稳（破锚收回或强阳跟进）再审 G1 多，入场须落在锚带内，不追市价"},{"missing":["语境不合：图读为大区间中部震荡而非下降趋势，决策根为阳线，无阴线信号 K"],"setup":"A2","watch":"若修复腿在要塞带下沿失败并重建 LH/LL、反弹走出第二腿至 EMA/前跌破位再审 A2"}],"primary":"H1","uncertainty":["附件 trend 标签为下降，与图读冲突（同一 0.62–1.17 大区间中部震荡），按图读为准","决策根长上影（高 1.062 收 1.0238）显示上方卖压，强阳成色打折","采样到达锚 0.9889 缺口已于 bar151 回补关闭（账本 closed，attempts 1），该锚 G1 立论销账","0.9535 origin 锚 opened_at=151、duration 0，尚无回测沉淀","C1 位置要求不合：现价距下跌腿极值 0.859 约 3.7 倍段均幅，不在极值区，不开审","mm 候选置信为边界，MM 目标仅作参考"]}