{"candidates":[],"context":"下降","hypotheses":[{"holds_if":"价格保持在EMA 6.233下方且反弹不收复P2下沿6.228，低点序列继续下移","id":"H1","menu":["A2","B1","B2"],"statement":"下降趋势延续：自5.5的两腿反弹已结束，价格重回跌势并考验5.5前低","takeover_if":"5.5在多次测试下不破且出现收回跌破的失败突破、或价格在5.5上方走出横盘筑底时备假设接管","void_if":"收盘站上6.35反弹高点并进一步收复6.744，或反弹收复本腿跌幅逾50%"},{"holds_if":"价格跌至或跌破5.5后1-3根内收回其上、且不再创出带跟进的新低","id":"H2","menu":["B3"],"statement":"备假设：5.5前低守住，跌势转入低位震荡磨底而非立即续跌","takeover_if":"跌破5.5失败并收回、随后反弹收复6.228时接管为主假设","void_if":"大实体阴线收盘跌破5.5并有跟进、远离前低走出新腿"}],"no_trade_reason":"位置不对","pending_conditions":[{"missing":["决策根收盘5.348不在P1 5.5±0.09测试区内","决策根为小实体阳线，无大实体阴线跌破加向下跟进的当根触发"],"setup":"B1","watch":"价格回测5.5沿口或在5.5下方走出大实体阴线收盘且下一根向下跟进时再审顺势空"},{"missing":["跌破5.5后未在1-3根内收盘收回5.5上方","无多头跟进实体"],"setup":"B3","watch":"收盘收回5.5上方且出现多头跟进实体时再审翻面多"},{"missing":["反弹未进入P2 6.228-6.744要塞带测试区","决策根非阴线实体收盘触发"],"setup":"A2","watch":"反弹进入6.228-6.744带内走出第二腿后出现阴线实体收盘且盘中不创新高时再审顺势空"}],"primary":"H1","uncertainty":["MM附件置信为边界且候选仅为早期腿投影，当前下跌腿无可靠投影，趋势成熟度无从投影","5.5下方无历史结构，跌破后下方空间未知","图读下降语境与附件下降标签一致，但决策根不在任何预画决胜点测试区内，无合格触发"]}