{"candidates":[],"context":"下降","hypotheses":[{"holds_if":"价格始终收在P4要塞78884.52之下且反弹高点不越78781.24，反弹呈两腿衰竭","id":"H1","menu":["A2","B2"],"statement":"下降趋势未改，反弹属逆势回调，回调结束后顺势再探76650.02并赴MM投影74476.61","takeover_if":"收盘突破78884.52且回踩不破，或P1跌破后1-3根内强势收回并跟进，则备假设接管","void_if":"收盘站上78884.52并有跟进，收复反弹高点一带"},{"holds_if":"P1支撑76650.02守住且收盘收复78577.31、进而突破78884.52","id":"H2","menu":["B3"],"statement":"急跌后在76650.02一带筑底转为震荡/反弹，先收复上方阻力带","takeover_if":"收盘跌破76650.02并出现回踩第二腿阴实体确认时，主假设重新接管","void_if":"收盘有效跌破76650.02且回踩失败，顺势下行确认"}],"no_trade_reason":"位置不对","pending_conditions":[{"missing":["决策根收盘77140.01不在P4决胜点78649.67-78884.52±65.33内，也不在P3区77991.89-78577.31±65.33内","反弹仅1腿，pullback.legs=1、two_legs=false，未走出第二腿","决策根最后K实体占比0.2618，无顺向阴实体收盘触发且信号K成色不足"],"setup":"A2","watch":"等反弹到达P4 78649.67-78884.52并走出第二腿后出现顺向阴实体收盘、信号K大半截不在EMA错侧且盘中不创反弹新高；P3 77991.89-78577.31触发须与P4共振才执行"},{"missing":["未收盘跌破P1 76650.02","无破位后回踩被破位走出的第二腿形态","无回踩第二腿顺向阴实体收盘触发"],"setup":"B2","watch":"等收盘跌破76650.02后回踩该位走出第二腿并出现顺向阴实体收盘、无盘中反向新极值"},{"missing":["未发生跌破76650.02后1-3根内收盘收回位内的失败裁定","无反向多头跟进实体K"],"setup":"B3","watch":"等跌破76650.02后1-3根内收盘收回位内并出现反向多头跟进实体K"},{"missing":["敞开缺口锚80472.61距决策价77140.01甚远，落点不在该锚±65.33内且无同址多锚叠加到达","缺口attempts=0，无回补未遂后反向跟进或到达后顺势强信号K等到达行为R3"],"setup":"G1","watch":"等价格到达80472.61锚线附近落点区并出现回补未遂后反向跟进或第二次回补未遂行为"}],"primary":"H1","uncertainty":["附件MM置信为边界：以bar371高点80954.65到bar396低点76650.02主跌腿投影74476.61，若以81900.0全腿起算投影更低，目标深度存疑","图读下降语境与附件trend下降/确定一致，无图与附件冲突","决策根位于P1支撑76650.02-76855.52与P2据点77252.14-77577.49之间赶路区，两点均不在±0.25×段均幅65.33测试区内"]}