{"candidates":[],"context":"震荡","hypotheses":[{"holds_if":"回落延续、反弹不过 0.9492 前低锚，价格继续向 0.8265 靠拢","id":"H1","menu":["G1","B3"],"statement":"宽幅震荡未变：1.1695 顶部回落的熊腿仍向下方的缺口锚簇赶路，决策点位于区间中部，不在决胜点上，无扳机","takeover_if":"价格到达 0.8265±0.018 后出现回补未遂的强阳跟进，或下破 0.8265 后 1-3 根内收回收复（翻面）","void_if":"收盘强势站回 EMA20 0.9567 上方并有跟进"},{"holds_if":"反弹在 0.9492/1.026 一带受阻回落，并收盘跌破 0.8265","id":"H2","menu":[],"statement":"备选：顶部 1.1695 系区间上沿假突破，熊方接管，熊腿以 0.7339 起点缺口为深层目标走第二腿","takeover_if":"收盘跌破 0.8265 且回抽不过该锚，下行延续另行审计空头入场","void_if":"收盘收复 1.026 缺口锚（套牢多头解套位）"}],"no_trade_reason":"位置不对","pending_conditions":[{"missing":["R3 到达行为缺失：价格尚未到达 0.8265 缺口锚（决策收盘 0.8749，距锚 0.0484，远超 0.25×段均幅 0.0180）","R2 落点叠加未确认：锚 ±0.018 内独立同源组锚不足（摆动低点 0.8522 在容差之外，MM 候选 1.0991/1.2978 不在同址）"],"setup":"G1","watch":"价格到达 0.8265 一带（bar 89 突破起点锚、套住空头）后 1-3 根内出现顺势强阳跟进，或回补未遂（attempts≥1）后的反向跟进"},{"missing":["回收窗口已过：1.1695 上破区间上沿失败的收回发生在 bar 102-104，决策点已远离翻面位，不在 1-3 根窗口内"],"setup":"B3","watch":"下方 0.8265 若被下破后 1-3 根内收回收复，按区间下破失败翻面重新审"}],"primary":"H1","uncertainty":["附件 trend 标签置信为「边界」；图读为宽幅震荡（0.62-1.17），与标签一致，但顶部回落熊腿的深度未定","0.8265 锚的同址独立锚在容差边缘，R2 等级未定","1.1695 顶部的性质（区间上沿假突破 vs 上涨高潮）图读倾向前者，未定"]}