{"candidates":[],"context":"震荡","hypotheses":[{"holds_if":"价格在P1与P5之间往返且每次冲边均无强收盘加跟进站到带外","id":"H1","menu":["B3"],"statement":"价格延续99.57-102.96大区间震荡,中部无单,两端只审突破失败翻面","takeover_if":"强阳收盘站上102.96并跟进、或到达P6后继续放量上行时备假设接管","void_if":"强实体收盘站上102.96或跌破99.57并有跟进,区间定性失效"},{"holds_if":"突破P4后回踩不破、再以强阳收盘越过102.07并有跟进","id":"H2","menu":["B2"],"statement":"向上突破区间上沿,先赴P6的MM投影102.07再考P5上沿外空间","takeover_if":"收盘带跟进站上102.96且回踩守住时本假设升为主假设","void_if":"冲上沿后1-3根内收盘收回102.27下方,突破判失败回到主假设"}],"no_trade_reason":"成色不合格","pending_conditions":[{"missing":["P4冲边后虽有收盘跌回100.93下方,但阴线跟进未出现:决策根为小阳线收100.87、实体占比低且收在上部,不是空头反向跟进K","触发K成色不合格:决策根方向与翻面方向相反,无法认定突破失败翻面已触发"],"setup":"B3","watch":"等价格再处P4(100.93-101.87)测试区、冲边后1-3根内收盘收回100.93下方并出现有方向实体的阴线跟进,再审P4翻面空"},{"missing":["强阳收盘站上102.96并有跟进未发生","突破后回踩守住102.27上方未发生"],"setup":"B2","watch":"等强阳收盘站上102.96并跟进、回踩守住102.27上方,再审P5顺势突破多"}],"primary":"H1","uncertainty":["附件trend机器标签为上升且账本多空双向被套冲突,与冻结地图及图读的大区间震荡定性冲突,按图读与地图为准","决策根前一根虽收回100.93下方,但决策根反为小阳线,回收后的跟进方向在决策时点尚不能由单根确认","P6的MM投影仅取最近小腿99.16到101.23口径,投影置信有限,不作放行依据"]}