{"candidates":[],"context":"下降","hypotheses":[{"holds_if":"反抽在159.86–161.38受阻并出阴线跟进、续创新低","id":"H1","menu":["G1"],"statement":"下降趋势未止：171以来LH/LL序列完整、EMA下行且价格在其下；当前强阳只是跌至157.5一带后的第一次反抽，赴上方159.86/161.38套多锚解套位，默认反抽不是反转","takeover_if":"站上161.38且回测不破，或MTR三件套补齐（TBTL完成＋第二腿衰竭确认）","void_if":"强阳收盘站上161.38并回测守住"},{"holds_if":"后续回测不破157.52并再出顺向阳线信号","id":"H2","menu":["C1","B3"],"statement":"低位反转候选在形成：158一带两度下探回升＋决策根强阳收近高点，若完成TBTL并回测守住157.58–158.45要塞带，MTR可审","takeover_if":"TBTL三件套补齐且信号K达合格级以上","void_if":"收盘跌破157.52创新低"}],"no_trade_reason":"成色不合格","pending_conditions":[{"missing":["TBTL未完成：仅决策根一根强阳，趋势线突破后的回测失败尚未出现","反转信号只有第一根，缺回测守位后的第二确认"],"setup":"C1","watch":"等回测157.58–158.45要塞带不破、再出合格级阳线信号K后全审三件套"},{"missing":["无窗口内（1–3根）新鲜突破可翻：下破159.86发生在6根前且其后已创新低，属趋势下行段而非刚失败的突破","收回位内＋反向跟进的翻面结构未在本窗口成立"],"setup":"B3","watch":"若出现对159.86/161.38的冲高突破后1–3根内收回锚下并阴线跟进，再审翻面空"},{"missing":["空向R3未齐：价格刚抵套多锚159.86，尚无冲高回补失败后的反向阴线跟进，决策根反而是强阳收近锚线（回补进行中）","多向R2未齐：套空锚157.52在现价下方约1.2倍段均幅，入场位不在锚线±0.43内，现价位正是套多锚的卖压落点"],"setup":"G1","watch":"空向等159.86–161.38一带冲高收回＋阴线跟进；多向等回踩157.52锚不破＋强阳跟进，两个方向都不抢跑"}],"primary":"H1","uncertainty":["机器标签为震荡/边界，与图读下降趋势（近50根LH/LL、EMA下行、价格在其下）冲突，以图读为准","MM候选仍引早期下行腿、置信边界，不作放行依据","决策根强阳仅一根，反转认定所需的回测与第二信号均未出现"]}