{"candidates":[],"context":"震荡","hypotheses":[{"holds_if":"价格继续在 1.457–1.527 之间往返、EMA 保持走平","id":"H1","menu":["B3","C1"],"statement":"低位区间筑底震荡：下行趋势在 1.431 见底后于 1.457–1.527 区间磨底约 28 根，决策根只是区间上半部对次级高点 1.498 的假冲回落，中部无单","takeover_if":"收盘站上 1.53 一带并回测不破，转反转审，H2 接管","void_if":"收盘有效突破 1.527 上方或收盘跌破 1.431 下方"},{"holds_if":"反弹至 1.50–1.53 一带再被拒、阴线收回 1.481 踩踏带下方","id":"H2","menu":[],"statement":"低位区间实为下跌中继，反弹耗尽后再下一腿回补下方空间","takeover_if":"收盘跌破 1.457 并进而跌破 1.431 极值，下行延续接管","void_if":"强阳收盘站稳 1.53 上方并跟进"}],"no_trade_reason":"位置不对","pending_conditions":[{"missing":["突破对象不成立：本轮只是冲过次级高点 1.498（高 1.515），区间真上沿 1.527–1.530 从未被破，无决胜点突破可翻","窗口裁定未成：决策根 bar114 是突破收盘后的第一根回调，按卡规属突破方、不算失败，且无后续反向跟进"],"setup":"B3","watch":"价格上冲 1.527–1.546 要塞带后 1–3 根内收盘收回 1.527 下方并阴线跟进，再审翻面空"},{"missing":["TBTL 未成立（无趋势线被破且回测失败的明确事件，EMA 仅走平）","入场位置不合：现价 1.488 在区间中部，不在原趋势极值区/要塞沿口","反转方向信号 K 缺失（决策根为阴线、CLV −0.24，与做多触发相反）"],"setup":"C1","watch":"回落 1.431–1.457 极值区出现二次衰竭加合格强阳信号，或收盘站上 1.527 后回测不破时重审"},{"missing":["R1 不合：敞开缺口全为套多（1.501/1.548/1.553/1.56/1.649/1.67），无套空缺口，做多缺回补方向账；做空镜像同样不成立","R2 不合：现价 1.488 距最近缺口锚 1.501 为 0.013，超过 ±0.25×段均幅（约 0.0038）","R3 缺失：全部敞开缺口 attempts=0，无回补未遂等到达行为"],"setup":"G1","watch":"价格到达 1.548–1.560 缺口簇同址要塞带（1.546–1.569）时出现回补未遂或强信号行为，再审 G1 矩阵"}],"primary":"H1","uncertainty":["大级别下行背景未销账：上方套多缺口簇 1.548–1.67 全部敞开，做多即便触发也须先审计这批上方目标与供给","区间真上沿取 bar78 锚 1.527 与 bar74 的 1.530 视为同址一带审，未逐分拆分"]}