{"candidates":[],"context":"上升","hypotheses":[{"holds_if":"后续收盘不站稳 0.2899 上方、价格向 P1/P2 回落且在架上出现承接","id":"H1","menu":["B3","B1"],"statement":"单日垂直尖峰属高潮事件而非新常态：价格大概率回吐，先考 P1 前顶与 P2 旧顶架的承接，回落完成前不追高","takeover_if":"收盘站上尖峰高并回踩守住，或回踩 P1 出第二腿阳线信号，H2 接管","void_if":"收盘站上 0.2899 并跟进扩展"},{"holds_if":"回踩不破 P1 且出现阳线第二腿，或直接收盘站上 0.2899","id":"H2","menu":["B2","B3"],"statement":"尖峰是新趋势的突破事件：回踩 P1/P2 守住后继续上行、尖峰高点被收复","takeover_if":"回踩守住出信号或站上尖峰高即接管为主假设","void_if":"收盘跌破 0.1663（尖峰全数回吐、事件证伪）"}],"no_trade_reason":"位置不对","pending_conditions":[],"primary":"H2","uncertainty":["战役作废事件：第 92–94 根一带收盘站上 0.2899 并跟进扩展（收盘 0.3113、0.3279，盘中高点 0.3721），触发 campaign_void_if 第二条——新台阶成立，整图作废需重画；P4 分支的 void（收盘站上 0.2899 并跟进）与 H1 的 void_if 同步触发，H2 已按 takeover_if 接管。当前价 0.2896 虽回到 P4（0.2899）测试区内，但地图已作废、分支不许复活，故不写候选。"]}