{"candidates":[],"context":"上升","hypotheses":[{"holds_if":"回调在 1.337 上方止跌并收出阳实体信号 K（不创回调新低）","id":"H1","menu":["A1","G1"],"statement":"成熟上升趋势在 1.445 尖峰高潮后进入回调，1.337 缺口锚与 EMA 一带是决胜测试区，守住并出顺势阳信号则趋势延续","takeover_if":"收破 1.336 后反抽 1.337–1.368 失败，H2 接管","void_if":"收盘跌破摆动低 1.336"},{"holds_if":"收破 1.336 且 EMA 翻平向下、反抽不过 1.368","id":"H2","menu":["C1"],"statement":"1.445 尖峰为高潮顶，当前回调是 MTR 雏形而非普通回踩","takeover_if":"收盘跌破 1.336 后回测 1.337–1.368 失败即接管","void_if":"强阳收复 1.405 并站稳其上"}],"no_trade_reason":"成色不合格","pending_conditions":[{"missing":["回吐深度 56.6% 已越本卡 50% 降级线，顺势面降级为观察","决策根为阴线（body 56%、CLV −0.44），无合格级顺势阳信号 K","回踩未在 EMA/前突破位出现止跌确认"],"setup":"A1","watch":"价格在 1.337–1.350 区止跌并收阳实体信号 K 后，按第二腿已完成重审 A1"},{"missing":["R3 到达行为未现：价格未到达敞开缺口锚 1.337（本段最低 1.353，锚+容差 1.344 之外）","R2 落点未成立：现价 1.358 不在锚 ±0.25×段均幅（±0.0068）内"],"setup":"G1","watch":"价格到达 1.337 锚一带出现回补未遂后的反向跟进或顺势强阳，再审 G1 多（R1 账本：1.337 origin 套空缺口仍敞开）"},{"missing":["TBTL 未确认：价格仍在 EMA（1.350）上方、未收破摆动低 1.336","趋势线突破后的回测失败未出现，两腿衰竭仅有尖峰一腿证据"],"setup":"C1","watch":"收盘跌破 1.336 且反抽 1.337–1.368 失败，再审 C1 空"}],"primary":"H1","uncertainty":["附件 mm 候选为早期下跌腿的下行投影（1.027/1.052）、置信边界，与当前上升结构无关，未用作目标审计","附件 recent 趋势标签未定，与全图上升定性不冲突：近端为高潮后回调段，趋势是否成熟转区间待 1.337 测试结果"]}