{"candidates":[],"context":"震荡","hypotheses":[{"holds_if":"收盘守住0.1219上方且回踩不破0.1204，向上推进保持高低点抬高","id":"H1","menu":["A1","B2","B1"],"statement":"深跌后恢复上升未破，守住下方支撑后逐级上考0.1233与0.124缺口位","takeover_if":"价格上冲0.1233后1-3根内收回0.1233内并反向跟进，或收盘跌破0.1214时备假设接管","void_if":"收盘跌破0.1204且跟进走弱"},{"holds_if":"0.1233附近出现突破失败或冲高无跟进，价格重新收回0.1233内","id":"H2","menu":["B3"],"statement":"上升只是大跌后的区间修复，0.1233-0.1240上方套牢区压制后回落向0.1204","takeover_if":"0.1233突破失败翻面成立或收盘跌破0.1214时接管","void_if":"强收盘突破0.1233并站稳、继续向0.1257推进"}],"no_trade_reason":"位置不对","pending_conditions":[{"missing":["决策根收盘0.1222不在P3决胜点0.1214-0.1219±0.25×段均幅内","回踩第二腿与阳实体收盘触发未出现"],"setup":"A1","watch":"等价格回踩至0.1214-0.1219，走出第二腿且阳实体收盘、不再创盘中新低时按P3分支审A1"},{"missing":["价格未到达P4决胜点0.1204","回踩第二腿与阳实体收盘触发未出现"],"setup":"A1","watch":"等价格回踩0.1204，走出第二腿且阳实体收盘、不再创盘中新低时按P4分支审A1"},{"missing":["价格未到达P1阻力0.1233","强势突破收盘与下一根跟进未出现"],"setup":"B1","watch":"等价格上考0.1233，收盘强势突破且下一根跟进不收回0.1233内时按P1分支审B1"},{"missing":["价格未到达P1阻力0.1233且未发生突破","突破后1-3根内收回0.1233内并反向跟进未出现"],"setup":"B3","watch":"等价格突破0.1233后1-3根内收盘收回0.1233内并出现反向跟进时按P1分支审B3"},{"missing":["价格未到达P2阻力0.1257-0.1265","到达后突破失败与收回0.1257内并反向跟进未出现"],"setup":"B3","watch":"等价格到达0.1257-0.1265后突破失败、1-3根内收回0.1257内并反向跟进时按P2分支审B3"},{"missing":["R3到达行为未出现：敞开缺口回补未遂次数为0且落点区无强信号K","决策根不在缺口锚与预画决胜点叠加的测试区内"],"setup":"G1","watch":"等价格进入0.1214缺口锚±0.25×段均幅且与P3支撑叠加区，出现回补未遂后反向跟进或第二次回补未遂时审G1"}],"primary":"H1","uncertainty":["图读近段为震荡、EMA走平、K线重叠，与战役地图语境上升不一致；位置与决胜点以地图为准，地图H1前提破条件收盘跌破0.1204未触发，故主假设仍保留H1","附件trend标签为震荡、置信边界，与图读震荡一致；附件MM置信边界且地图注向上MM无可靠投影，上方只能按0.1233与0.1240逐级审","决策根收盘0.1222距最近决胜点P3上沿0.1219为0.0003，超出±0.25×段均幅容差（段均幅0.000155，容差约0.000039），亦远离P1阻力0.1233，属两决胜点之间赶路区"]}