{"candidates":[],"context":"震荡","hypotheses":[{"holds_if":"收盘保持在0.3203上方且未站上0.337，高低点无持续方向序列","id":"H1","menu":["B3","G1"],"statement":"冲顶0.337后转入高位震荡，价格自0.3287回落探试下沿，尚无合格续涨或反转触发","takeover_if":"0.337附近出现两腿衰竭且回测失败，或反弹在P3走出空头信号K并随后跌破0.3228时备假设接管","void_if":"收盘站上0.337创新高或收盘跌破0.3203"},{"holds_if":"反弹不过0.3308且随后跌破0.3228并有跟进","id":"H2","menu":["C1","A2"],"statement":"冲顶后主要趋势反转向下，此前自0.3228的反弹只是回测阻力","takeover_if":"P3内出现合格阴实体信号K且不创0.3308上方新高，或P4附近双顶衰竭与趋势线回测失败齐备","void_if":"收盘突破0.337并出现多头跟进"}],"no_trade_reason":"位置不对","pending_conditions":[{"missing":["跌破0.3222后1-3根内收盘收回0.3238上方","收回后多头跟进"],"setup":"B3","watch":"等价格在P1带0.3222-0.3238附近完成收回动作且决策根收盘落入该点容差内"},{"missing":["第二次下探0.3202附近并回补未遂","回补未遂后强多头信号K收在落点上方"],"setup":"G1","watch":"等价格进入P2要塞0.3202-0.3203容差区并出现第二次回补未遂与反向跟进"},{"missing":["价格回到P3带内","反弹第二腿合格阴实体信号K"],"setup":"A2","watch":"等反弹进入P3带0.3269-0.3308且不创0.3308上方新高时再审空头信号K"}],"primary":"H1","uncertainty":["决策根收盘0.3214位于P1容差下限约0.3217下方与P2容差上限约0.3208上方之间，不在任一决胜点测试区内","附件MM仅给出早期腿目标且置信为边界、均已被现价远超，近期冲顶腿无新投影可核，MM已达依冻结地图备忘","价格滑至0.3228下方提示备假设压力，但P3未见图读合格阴实体信号K、P4的MTR三件套未齐，不足以认定接管，临近P2要塞亦不许追空"]}