{"candidates":[],"context":"下降","hypotheses":[{"holds_if":"价格在P2/P3下方受阻并收出弱反抽、跌破反抽低点","id":"H1","menu":["B2","B3"],"statement":"冲高见顶后空头主导，反抽是下跌中继，考上方阻力不过则续跌向P1","takeover_if":"P1出现第二次下探失败且强阳收回0.07693上方时备假设接管","void_if":"收盘站上0.08054并回踩不破"},{"holds_if":"P1不再创新低且价格收复P2并在上方站稳","id":"H2","menu":["B3","C1"],"statement":"急跌为卖出高潮，P1守住后进入筑底震荡并向上回补套牢多头缺口","takeover_if":"收盘跌破0.0722并有跟进时主假设重新接管续跌","void_if":"收盘跌破0.0722"}],"no_trade_reason":"位置不对","pending_conditions":[{"missing":["决策根未到达P2：决策根区间0.07557-0.07599未与P2区间0.07664-0.07693相交，收盘0.07568亦不在P2±0.25×段均幅0.0003425内","P2受阻的合格空头信号K未出现","信号K低点下方stop触发未发生"],"setup":"B2","watch":"等反抽进入P2 0.07664-0.07693受阻并收出合格空头信号K，再在其低点下方触发"},{"missing":["决策根未到达P3：收盘0.07568不在P3 0.07742±0.25×段均幅0.0003425内","P3回测失败与收盘收回0.07742下方并有跟进阴线未发生"],"setup":"B2","watch":"等反抽到达P3 0.07742回测失败、收盘收回其下方并出现跟进阴线"},{"missing":["决策根未到达P1：决策根区间未与P1 0.0722相交，limit轨未到达","下探P1后1-3根内收回其上方并出现反向强跟进阳线未发生"],"setup":"B3","watch":"等价格下探P1 0.0722后1-3根内收回其上方并出现反向强跟进阳线"},{"missing":["决策根未到达P4：决策根区间未与P4区间0.08054-0.0809相交，limit轨未到达","上冲P4后1-3根内收盘收回0.08054下方并出现反向跟进未发生"],"setup":"B3","watch":"等价格上冲P4 0.08054-0.0809后1-3根内收盘收回0.08054下方并出现反向跟进"},{"missing":["R3到达行为未成立：决策根未到达敞开缺口锚落点P4 0.08054-0.0809，敞开缺口attempts均为0，无回补未遂后反向跟进或落点区强信号K"],"setup":"G1","watch":"等价格到达P4缺口锚区并在区内/边缘出现回补未遂后反向跟进或顺势强信号K，再逐项核R1/R2/R3与V1/V2/V3"}],"primary":"H1","uncertainty":["急跌后价格在低位横盘，图读近端呈震荡整理，与冻结地图的下降战役语境不完全一致；位置与战役状态以冻结地图为准","冻结地图自带不确定性：急跌仅33根且反抽未定型，无法确认是高潮见底还是下跌第一腿中继，MM已达依据为前上升腿目标0.0785已被0.08148高点超越","决策根位于P1与P2之间的赶路区，按分轨口径limit与market两轨均未到达任一决胜点"]}