{"candidates":[],"context":"震荡","hypotheses":[{"holds_if":"收盘始终被14.20与13.84封在区间内且边缘冲刺均在1–3根内被收回","id":"H1","menu":["B3"],"statement":"价格在14.12–14.20上沿与13.84下沿之间继续震荡，边缘突破默认假、只审失败翻面","takeover_if":"价格收盘跌破13.84并跟进、反抽13.88失败时备假设接管","void_if":"强收盘越过14.20或跌破13.84并出现跟进扩展"},{"holds_if":"14.12–14.20一带冲高持续被收回且摆动低点序列下移","id":"H2","menu":[],"statement":"上方14.20久攻不下后空头恢复早前下跌，跌破13.84后向13.57–13.67主要低点区推进","takeover_if":"收盘跌破13.84带跟进且回抽不能收回13.88时本假设接管为主","void_if":"强收盘站上14.22并向14.28–14.35缺口区扩展"}],"no_trade_reason":"无命中","pending_conditions":[{"missing":["P1突破失败的反向跟进未出现：决策根虽盘中上冲逾14.20/14.22后收盘收回14.15，但决策根为阳线，无收回后1–3根内的跟进阴线，触发K无方向阴实体","P4尚未到达：决策收盘14.15不在14.28–14.35区内，无上冲失败后收盘跌回14.28下方的行为"],"setup":"B3","watch":"等价格再冲14.20上方后1–3根内收盘收回14.20下方并出现跟进阴线，在P1（14.12–14.20）审短翻面；或到达P4（14.28–14.35）失败后收盘跌回14.28下方并跟进再审"},{"missing":["回踩第二腿未走出：回踩腿数为1、非两腿","回吐深度比0.5846已逾50%降级线，且当前落点在14.12–14.20阻力带而非EMA一带/前突破位/要塞上沿翻面位的顺势支撑测试区"],"setup":"A1","watch":"等上升语境重新成立、回踩走出第二腿并落在EMA一带或要塞支撑测试区、出现合格顺向阳信号K再审"},{"missing":["R3到达行为缺失：敞开缺口回补尝试次数均为0，无回补未遂后反向跟进，也无到达后1–3根内顺势强信号K","R2落点未到达：决策收盘14.15未进入14.28缺口锚±0.25×段均幅的落点区，P4叠加位尚未被测试"],"setup":"G1","watch":"等价格到达14.28–14.35的P4落点区并出现回补未遂或第二次回补失败的明确到达行为再审"}],"primary":"H1","uncertainty":["附件trend标签为上升与图读及冻结地图的震荡定性冲突：图上价格自13.57低点反弹后长期在13.84–14.22间往返、无持续HH+HL，按规则以图读与冻结地图为准","附件账本一致性为冲突：上方14.28/14.35/14.68套住多头、下方13.74套住空头，双方均有敞开缺口，方向不可单凭账本辨","附件MM候选置信为边界且仅源自开局下腿，冻结地图注记趋势MM无从投影，故不以MM作放行依据"]}