{"candidates":[],"context":"上升","hypotheses":[{"holds_if":"回踩走完两腿并在0.0740–0.0746区止跌、出阳信号K","id":"H1","menu":["A1"],"statement":"上升趋势晚段，0.0791边际新高与前高0.0792构成双顶嫌疑，当前为回踩第一腿进行中，先看两腿修正至0.0746一带再定延续或翻面","takeover_if":"收盘破0.0740且回测0.0757一带失败，H2接管","void_if":"强阴收盘破0.0740，或强阳收盘站上0.0792并跟进"},{"holds_if":"收盘破0.0753且回测0.0757–0.0775失败、出强阴跟进","id":"H2","menu":["B3","C1","G1"],"statement":"顶部派发成立，边际新高失败演为翻面/MTR下行，目标先看0.0746、0.0725套空锚回补","takeover_if":"强阴破0.0740加回测失败的事实出现","void_if":"强阳收回0.0791上方并站稳"}],"no_trade_reason":"位置不对","pending_conditions":[{"missing":["回踩仅一腿（附件pullback legs=1、two_legs=false），第二腿未成形","回吐深度0.63已越50%降级线，且决策根为阴线，无顺向阳信号K"],"setup":"A1","watch":"等回踩走完两腿至0.0746敞开套空锚/要塞带0.0734–0.0746一带，出现阳实体信号K再审"},{"missing":["R2落点已漂移：现价0.0766距套多锚0.0791约3倍段均幅，不在锚±0.25×段均幅容差内，决策点不在决胜点上","R3时效与成色不足：0.0791到达在8根前，其后112–118为重叠弱阴漂移，无一根达强K口径的阴信号"],"setup":"G1","watch":"等价格反抽0.0775–0.0791锚区失败并出强阴信号K，或收盘破0.0753后回测失败再审"},{"missing":["翻面触发不成色：上破0.0775后的收回是7根重叠小阴漂移，无强阴跟进确认","决策点已离开翻面位且正贴EMA支撑，在此做空无位置依托"],"setup":"B3","watch":"等强阴收盘破0.0753（bar106低点）确认翻面，或反抽翻面位失败出阴信号K"},{"missing":["TBTL未成立：回落仅贴EMA滑行，无强破趋势线后的回测失败结构","衰竭证据不足：末腿仍创边际新高0.0791，仅与0.0792构成双顶嫌疑，未成两腿衰竭事实"],"setup":"C1","watch":"等收盘破0.0740后回测0.0757一带失败，按MTR三件套复审"}],"primary":"H1","uncertainty":["附件trend=上升/确定，但图读为趋势晚段双顶嫌疑区，顺势菜单按成熟趋势打折审","附件MM候选为早期下跌腿投影且置信边界，对当前上升语境不可用，未纳入目标审计","回吐深度0.63为附件口径，与图读单腿回踩一致，但第二腿是否展开未定"]}