{"candidates":[],"context":"震荡","hypotheses":[{"holds_if":"价格在 0.335–0.372 间往返，上下突破均无跟进收盘，回踩在下方要塞带逐级被接","id":"H1","menu":["B3","G1"],"statement":"尖峰腿 0.3056→0.3719 是暴涨高潮，高潮后两腿回踩已回吐 55%，价格转入 0.335–0.372 宽幅震荡消化；账本 11 条套空缺口全在下方，下方回补位是磁石也是潜在燃料","takeover_if":"价格到达 0.3024–0.3123 汇合区并出现回补未遂或强阳信号，H2 的深回踩顺势剧本接管","void_if":"收盘站上 0.3719 并跟进创新高（高潮后趋势直接恢复），或收盘跌破 0.3353 且向 0.3166 加速（回调升级为反转腿）"},{"holds_if":"回踩在 0.3354–0.3405 带或更深的 0.3024–0.3123 汇合区止跌，并出强顺向信号 K 收回带上方","id":"H2","menu":["G1"],"statement":"回调只是尖峰后的健康消化：上升大结构（0.2613 起的 HH/HL）未破，守住下方汇合区后买方将再攻 0.3719","takeover_if":"收盘站稳 0.3719 上方并跟进，高位震荡定性作废、趋势恢复","void_if":"收盘跌破 0.3024 带下沿、且回补 0.298 缺口锚后站回锚下不回，消化变质为深度反转"}],"no_trade_reason":"位置不对","pending_conditions":[{"missing":["R2 落点未到达：现价 0.3456 距最近敞开缺口锚 0.3166 约 0.029（约 4.8×段均幅），更未到主汇合带 0.3024–0.3123","R3 到达行为缺失：全部敞开缺口 attempts=0，价格未达锚位，无回补未遂、无到达后强信号"],"setup":"G1","watch":"等回踩到达 0.3024–0.3123 汇合区（缺口锚 0.3028/0.298、要塞带 0.3024–0.3123、前基底上沿 0.3053 三方同址），出现回补未遂后反向跟进、或 1–3 根内强阳信号 K 收在带上方，再按条件矩阵全审多"},{"missing":["决策点前 1–3 根内无新鲜突破事件：冲 0.3719 发生在约 20 根前，回收窗口早已走满，无从裁定失败"],"setup":"B3","watch":"若价格再上破 0.3719 后 1–3 根内收盘收回位内并反向跟进，在翻面位 0.3719 审空；或下破 0.3353 后快速收回并顺向跟进，按失败破位次根审多侧翻面"}],"primary":"H1","uncertainty":["语境分界存疑：全段是 0.2613 起的上升结构、近端是高潮后回调，定性取决策时点的高位震荡；若回踩守不住 0.3166–0.3024 一带，定性须下修为趋势反转进行中","C1 顶部反转已审但不立候选：趋势线已破、0.352 做出 LH 一次回测失败，然衰竭腿数不足两次、且现价 0.3456 在回调中部而非极值区，三件套不齐","附件 MM 候选置信=边界且为早期小腿投影（0.30/0.2911），对尖峰腿无定价力；尖峰已在 0.3719 兑现高潮的判断来自腿高与形态自读"]}